<?xml version="1.0" encoding="UTF-8"?>
<equiposdefutbol xmlns:xsi="http://www.w3.org/2001/XMLSchema-instance" xsi:noNamespaceSchemaLocation="file:///C:/IFCD0210/MF0491-3%20CLIENTE/UF1841/E2/equiposdefutbol.xsd">
	<equipo>
		<nombre>CD Tenerife</nombre>
		<ciudad>S/C de Tenerife</ciudad>
		<jugadores>
			<jugador posicion="portero">
				<nombre>Daniel Hernández</nombre>
				<nacionalidad>venezolana</nacionalidad>
			</jugador>
			<jugador posicion="defensa">
				<nombre>Luis Jesús Pérez</nombre>
				<nacionalidad>española</nacionalidad>
			</jugador>
			<jugador posicion="defensa">
				<nombre>Héctor Hernández</nombre>
				<nacionalidad>española</nacionalidad>
			</jugador>
			<jugador posicion="defensa">
				<nombre>Samuel Geoffroy</nombre>
				<nacionalidad>francesa</nacionalidad>
			</jugador>
			<jugador posicion="defensa">
				<nombre>Alberto Jiménez</nombre>
				<nacionalidad>española</nacionalidad>
			</jugador>
			<jugador posicion="centrocampista">
				<nombre>Luis Milla</nombre>
				<nacionalidad>española</nacionalidad>
			</jugador>
			<jugador posicion="centrocampista">
				<nombre>Jesús Manuel Santana</nombre>
				<nacionalidad>española</nacionalidad>
			</jugador>
			<jugador posicion="centrocampista">
				<nombre>Uroš Račić</nombre>
				<nacionalidad>servia</nacionalidad>
			</jugador>
			<jugador posicion="centrocampista">
				<nombre>Francisco Montañés</nombre>
				<nacionalidad>española</nacionalidad>
			</jugador>
			<jugador posicion="delantero">
				<nombre>Filip Malbašić</nombre>
				<nacionalidad>servia</nacionalidad>
			</jugador>
			<jugador posicion="delantero">
				<nombre>José Manuel García</nombre>
				<nacionalidad>española</nacionalidad>
			</jugador>
			<jugador posicion="delantero">
				<nombre>Alexander Mesa</nombre>
				<nacionalidad>española</nacionalidad>
			</jugador>
		</jugadores>
	</equipo>
	<equipo>
		<nombre>UD Las Palmas</nombre>
		<ciudad>Las Palmas de Gran Canaria</ciudad>
		<jugadores>
			<jugador posicion="portero">
				<nombre>Raúl Fernández-Cavada</nombre>
				<nacionalidad>española</nacionalidad>
			</jugador>
			<jugador posicion="defensa">
				<nombre>Alberto de la Bella</nombre>
				<nacionalidad>española</nacionalidad>
			</jugador>
			<jugador posicion="defensa">
				<nombre>David García</nombre>
				<nacionalidad>española</nacionalidad>
			</jugador>
			<jugador posicion="defensa">
				<nombre>David Omar Rodríguez</nombre>
				<nacionalidad>española</nacionalidad>
			</jugador>
			<jugador posicion="defensa">
				<nombre>Juan Torres Ruiz</nombre>
				<nacionalidad>colombiana</nacionalidad>
			</jugador>
			<jugador posicion="centrocampista">
				<nombre>Javi Castellano</nombre>
				<nacionalidad>española</nacionalidad>
			</jugador>
			<jugador posicion="centrocampista">
				<nombre>Iñigo Ruiz de Galarreta</nombre>
				<nacionalidad>española</nacionalidad>
			</jugador>
			<jugador posicion="centrocampista">
				<nombre>Slavoljub Srnić</nombre>
				<nacionalidad>servia</nacionalidad>
			</jugador>
			<jugador posicion="centrocampista">
				<nombre>Gabriel Martín</nombre>
				<nacionalidad>argentina</nacionalidad>
			</jugador>
			<jugador posicion="delantero">
				<nombre>Rubén Castro</nombre>
				<nacionalidad>española</nacionalidad>
			</jugador>
			<jugador posicion="delantero">
				<nombre>Tomas Pekhart</nombre>
				<nacionalidad>española</nacionalidad>
			</jugador>
			<jugador posicion="delantero">
				<nombre>Ezequiel Araujo</nombre>
				<nacionalidad>argentina</nacionalidad>
			</jugador>
			<jugador posicion="delantero">
				<nombre>Rafael Mir</nombre>
				<nacionalidad>española</nacionalidad>
			</jugador>
		</jugadores>
	</equipo>
	<equipo>
		<nombre>Albacete CD</nombre>
		<ciudad>Albacete</ciudad>
		<jugadores>
			<jugador posicion="portero">
				<nombre>José Antonio Caro</nombre>
				<nacionalidad>española</nacionalidad>
			</jugador>
			<jugador posicion="defensa">
				<nombre>Álvaro Arroyo</nombre>
				<nacionalidad>española</nacionalidad>
			</jugador>
			<jugador posicion="defensa">
				<nombre>Francisco García</nombre>
				<nacionalidad>española</nacionalidad>
			</jugador>
			<jugador posicion="defensa">
				<nombre>Ezequiel Gorosito</nombre>
				<nacionalidad>argentina</nacionalidad>
			</jugador>
			<jugador posicion="defensa">
				<nombre> Juan Gentiletti </nombre>
				<nacionalidad>italana</nacionalidad>
			</jugador>
			<jugador posicion="centrocampista">
				<nombre>Sulleyman Muntari</nombre>
				<nacionalidad>francesa</nacionalidad>
			</jugador>
			<jugador posicion="centrocampista">
				<nombre>Néstor Susaeta</nombre>
				<nacionalidad>española</nacionalidad>
			</jugador>
			<jugador posicion="centrocampista">
				<nombre>Daniel Torres</nombre>
				<nacionalidad>española</nacionalidad>
			</jugador>
			<jugador posicion="centrocampista">
				<nombre>Diego Hernández</nombre>
				<nacionalidad>argentina</nacionalidad>
			</jugador>
			<jugador posicion="delantero">
				<nombre>Ballou Jean</nombre>
				<nacionalidad>francesa</nacionalidad>
			</jugador>
			<jugador posicion="delantero">
				<nombre>Roman Zozulia</nombre>
				<nacionalidad>argentina</nacionalidad>
			</jugador>
			<jugador posicion="delantero">
				<nombre>Javier Acuña</nombre>
				<nacionalidad>española</nacionalidad>
			</jugador>
		</jugadores>
	</equipo>
</equiposdefutbol>
